{
    "general": {
        "name": "Topology name",
        "coordination_port": 9289,
        "heartbeat": 3200
    },
    "workers": [
        {
            "name": "srv1"
        }
    ],
    "spouts": [
        {
            "name": "pump1",
            "worker": "srv1",
            "type": "inproc",
            "working_dir": ".",
            "cmd": "spout_inproc.js",
            "args": [
                "-a",
                "action1"
            ],
            "init": {}
        }
    ],
    "bolts": [
        {
            "name": "bolt3",
            "worker": "srv1",
            "working_dir": ".",
            "type": "inproc",
            "cmd": "bolt_inproc.js",
            "args": [],
            "inputs": [
                {
                    "source": "pump1"
                }
            ],
            "init": {
                "forward": false
            }
        }
    ],
    "variables": {}
}
