{
    "general": {
        "name": "QMiner demo",
        "coordination_port": 9289,
        "heartbeat": 2000
    },
    "workers": [
        {
            "name": "srv1"
        }
    ],
    "spouts": [
        {
            "name": "pump1",
            "worker": "srv1",
            "type": "inproc",
            "working_dir": ".",
            "cmd": "spout_1.js",
            "args": [],
            "init": {}
        }
    ],
    "bolts": [
        {
            "name": "bolt_qm",
            "worker": "srv1",
            "working_dir": ".",
            "type": "inproc",
            "cmd": "bolt_qm.js",
            "args": [],
            "inputs": [
                {
                    "source": "pump1"
                }
            ],
            "init": {}
        }
    ],
    "variables": {}
}
